Key,Russian,English,German,French,Portuguese,Spanish,Italian,Romanian,Turkish,Polish,Czech,Korean,Chinese,ChineseTraditional,BrazilianPortuguese
Lessons2.9,"У вас получилось. Вернитесь обратно, снова нажав {0:N1}.",You did it. Now get back by pressing {0:N1} again.,"Du hast es geschafft. Kehre jetzt zurück, indem du erneut {0:N1} drücken.",Vous avez réussi. Maintenant revenez en appuyant sur {0:N1} à nouveau.,Você conseguiu. Agora volte pressionando {0:N1} novamente.,Lo hiciste bien. Ahora regresa presionando nuevamente la tecla {0:N1}.,Ce l'hai fatta. Ora torna indietro premendo {0:N1} di nuovo.,Ai reușit. Acum revino apăsând din nou tasta {0:N1}.,"Tebrikler, başardınız. Şimdi {0:N1} tuşuna basarak geri dönün.",Udało Ci się. Teraz wróć naciskając klawisz {0:N1} ponownie.,Udělal jsi to. Vraťte se opět stisknutím tlačítka {0:N1}.,반대편 운전실에 왔습니다. 다시 돌아가기 위해 {0:N1}키를 누르세요.,漂亮！现在我们按{0:N1}回到原来的驾驶室。,漂亮！現在我們按{0:N1}回到原來的駕駛室。,Muito Bem. Para voltar aperte  pressione {0:N1}.
Lessons2.10,Второй способ медленный. Теперь встаньте с кресла. Для этого нажмите кнопку {0:N1}.,"Another way is slower. Firstly, leave the chair by pressing {0:N1}.",Ein anderer Weg ist langsamer. Verlasse zunächst den Stuhl durch drücken von {0:N1}.,"Il existe une autre façon, plus lente. D’abord, quittez le siège en appuyant sur {0:N1}.","Outra maneira é mais lenta. Em primeiro lugar, deixe a cadeira pressionando {0:N1}.","Otra de las formas es mucho más lenta. En primer lugar, sal de tu asiento presionando la tecla {0:N1}.","Un altro modo è più lento. Per prima cosa, lascia la sedia premendo {0:N1}.","Cealaltă metodă este mai dificilă. Mai întâi, ridică-te de pe scaun, apăsând tasta {0:N1}.",İkinci yol ise daha yavaş. İlk olarak {0:N1} tuşuna basarak koltuktan kalkın.,"Druga metoda jest wolniejsza. Po pierwsze, opuść fotel naciskając klawisz {0:N1}.",Jiný způsob je pomalejší. Nejprve opusťte křeslo stisknutím tlačítka {0:N1}.,다른 방법은 조금 느립니다. {0:N1}키를 눌러 의자에서 일어나세요,另一种方法较为真实 首先，按{0:N1}离开座椅。,另一種方法較為真實 首先，按{0:N1}離開座椅。,"A outra maneira é mais lenta. Primeiro, levante-se da cadeira pressionando {0:N1}."
Lessons2.11,"Подойдите к двери выхода в сторону платформы. Чтобы открыть дверь, посмотрите на неё и нажмите {0:N1}.",Walk to the door towards the platform. Look at the door and press {0:N1} to open it.,"Gehe zur Tür in Richtung der Plattform. Sehen Sie sich die Tür an und drücken Sie {0:N1}, um sie zu öffnen.",Marchez vers la porte donnant sur le quai. Regardez la porte et appuyez sur {0:N1} pour l’ouvrir.,Caminhe até a porta em direção à plataforma. Olhe para a porta e pressione {0:N1} para abri-la.,Camina hacia la puerta que va hacia la plataforma. Mira la puerta y presiona la tecla {0:N1} para abrirla.,Cammina verso la porta verso la piattaforma. Guarda la porta e premi {0:N1} per aprirla.,"Mergi spre ușă. Pentru a o deschide, apasă tasta {0:N1}.",Perona açılan kapıya doğru yürüyünüz. Kapıya bakınız ve {0:N1} tuşuna basarak kapıyı açınız.,Podejdź do rzwi przy platformie. Spójrz na nie i naciśnij {0:N1} aby je otworzyć.,Jděte ke dveřím směrem k nástupišti. Podívejte se na dveře a stisknutím tlačítka {0:N1} je otevřete.,승강장이 있는 쪽의 문으로 가서 {0:N1}키를 눌러 문을 여세요,走到面向疏散月台一侧的驾驶室门处  看到提示语后按{0:N1}将其打开。,走到面向疏散月臺一側的駕駛室門處 看到提示語後按{0:N1}將其打開。,Vá até a porta que leva para a plataforma. Olhe para a porta e pressione {0:N1} para abrir.
Lessons2.12,Пройдите к кабине поезда в другой стороне состава.,Get to the cabin at the other end of train.,Gehe in die Kabine am anderen Ende des Zuges.,Rendez-vous à la cabine de l’autre côté du train.,Chegar à cabine do outro lado do trem.,Llega hasta la cabina ubicada al final del tren.,Raggiungi la cabina dall'altra parte del treno.,Mergi spre cabina din capătul celălalt al trenului.,Trenin diğer ucundaki kabine gidiniz.,Przejdź do kabiny na drugim końcu pociągu.,Jděte do kabiny na druhém konci vlaku.,반대편 운전실로 이동하세요.,走到另一边的驾驶室。,走到另一邊的駕駛室。,Entre na cabine no outro lado do trem.
Lessons2.13,Откройте дверь и сядьте на место машиниста. Для этого подойдите к креслу и нажмите кнопку {0:N1}.,Open the door and sit down. Get close to the chair and press {0:N1} to do it.,"Öffne die Tür und setz dich. Gehen Sie näher an den Stuhl und drücken Sie {0:N1}, um dies zu tun.",Ouvrez la porte et asseyez-vous. Rapprochez-vous du siège et appuyer sur {0:N1} pour vous y asseoir.,Abra a porta e sente-se. Aproxime-se da cadeira e pressione {0:N1} para fazê-lo.,Abre la puerta y siéntate. Acércate bien a la silla y presiona {0:N1} para hacerlo.,Apri la porta e siediti. Avvicinati alla sedia e premi {0:N1} per farlo.,"Deschide ușa și așează-te pe scaun. Pentru a te așeza, apasă tasta {0:N1}.",Kapıyı açınız ve koltuğa oturunuz. Oturmak için koltuğa yaklaşıp {0:N1} tuşuna basınız.,Otwórz drzwi i usiądź. Zbliż się do fotela i naciśnij klawisz {0:N1}.,Otevřete dveře a posaďte se. Přiblížte se k sedadlu a stiskněte tlačítko {0:N1}.,문을 열고 {0:N1}키를 눌러 의자에 앉으세요,打开驾驶室门并坐下 走到座位旁按{0:N1}即可坐下。,打開駕駛室門並坐下 走到座位旁按{0:N1}即可坐下。,Abra a porta e sente-se. Aproxime-se da cadeira e pressione {0:N1}.
Lessons2.14,Переведите контроллер реверса в положение «Вперед» - {0:N1}.,Move the reverse switch to “Forward” position ({0:N1}).,Bringen Sie den Rückwärtsschalter in die Position «Vorwärts» ({0:N1}).,Déplacez la manette d’inverseur sur la position «Marche avant»({0:N1}).,Mova o interruptor de inversão para a posição «Avançar» ({0:N1}).,Mueve el controlador inverso a la posición «Avanzar» ({0:N1}).,Spostare l'interruttore di retromarcia nella posizione «Avanti» ({0:N1}).,Mută inversorul în poziția «Înainte» ({0:N1}).,Geride olan vites kontağını «İLERİ» konumuna getiriniz  ({0:N1}).,Przełącz nastawnik do pozycji «Naprzód» ({0:N1}).,Přepínač přepněte do polohy «vpřed» ({0:N1}).,역전간을 전진 위치에 두세요. ({0:N1}),将档位调整到“前进”的位置({0:N1})。,將檔位調整到“前進”的位置({0:N1})。,Mude o interruptor reverso para «Frente» ({0:N1}).
Lessons2.15,"Переведите две стрелки таким образом, чтобы они организовали путь в правый тоннель (на второй путь). Когда путь будет построен правильно, загорится синий сигнал светофора, а под ним высветится номер пути.","Now move the switch arrows in a way that they will lead you to the tunnel to the right (to the second track). When you do it, traffic light will turn blue and track number will be displayed under it.","Bewege nun die Schalterpfeile so in Position, dass sie zum Tunnel nach rechts (zur zweiten Spur) führen. Wenn Sie dies tun, wird die Ampel blau und die Gleisnummer wird darunter angezeigt.","Maintenant, déplacez les aiguillages de façon à pouvoir vous déplacer vers le tunnel sur votre droite (à la voie secondaire). Une fois cela fait, le signal deviendra bleu et le numéro de la voie sera affiché juste en dessous.","Agora mova as setas do interruptor de forma que elas o levem para o túnel à direita (para a segunda faixa). Quando você fizer isso, o semáforo ficará azul e o número da faixa será exibido abaixo dele.",Ahora mueve las flechas de desvío de tal modo que te lleven al túnel de la derecha (al segundo carril). Cuando lo hagas el semáforo se pondrá en azul y el número del carril aparecerá por debajo.,"Ora sposta le frecce dell'interruttore in modo che ti condurranno al tunnel a destra (verso la seconda traccia). Quando lo fai, il semaforo diventa blu e sotto di esso viene visualizzato il numero di traccia.","Acum schimbă macazele în așa fel încât traseul să ducă spre tunelul din dreapta (a doua linie). După ce vei face asta, lumina semnalului se va face albastră și numărul liniei va apărea dedesubt.",Şimdi makas oklarını sizi sağdaki tünele götürecek şekilde ayarlayınız (İkinci ray hatına doğru). Başardığınız zaman trafik lambası maviye dönecek ve altında hat numarası belirecek.,"Przestaw zwrotnice w sposób umożliwiający Ci dostanie się do tunelu z prawej strony (na tor drugi). Kiedy zwrotnice będą ustawione poprawnie, śygnalizator wyswietli niebieskie światło oraz numer toru.","Nyní posuňte šipky spínače tak, aby vás vedly k tunelu vpravo (k druhé koleji). Když to uděláte, rozsvítí se na displeji modrá světelná kontrolka a pod ním se zobrazí číslo trasy.",이제 오른쪽 터널(2번 선로)로 향하도록 선로를 전환하세요. 적절하게 진로가 개통되면 신호기가 청색을 현시하고 그 아래에 선로번호가 표시됩니다.,现在移动道岔箭头，它们将引导您到达右侧的隧道（第2个轨道）  当您这样做时，信号灯将变为蓝色，并在其下方显示轨道编号。,現在移動道岔箭頭，它們將引導您到達右側的隧道（第2個軌道） 當您這樣做時，信號燈將變為藍色，並在其下方顯示軌道編號。,"Agora mude as setas de modo que elas te levem até o túnel da direita (para a segunda linha). Quando você fizer, as luzes de tráfego estarão azuis e o número da linha será exibido abaixo."
Lessons2.16,Выезжайте из тупика и подайте состав под посадку.,Leave the dead end and stop at the station.,Verlassen Sie die Sackgasse und halten Sie am Bahnhof.,Quittez la voie de retournement et arrêtez-vous à lastation.,Deixe o beco sem saída e pare na estação.,Ahora sal de la topera y detente en la estación.,Lascia il vicolo cieco e fermati alla stazione.,Părăsește capătul liniei și oprește la următoarea stație.,Çıkmaz yoldan ayrılın ve istasyonda durun.,Opuść tor i zatrzymaj się na stacji.,Opusťte slepou kolej a zastavte se na stanici.,회차선을 떠나서 역에 정차하세요.,现在离开存车线，前往并停靠在车站。,現在離開存車線，前往並停靠在車站。,Saia da estação de retorno e pare na próxima estação.
Lessons2.17,Хорошо! Теперь выйдите из поезда на платформу.,Good! Now leave your chair and walk to the platform.,Gut! Verlassen Sie jetzt Ihren Stuhl und gehen Sie zur Plattform.,"Super! Maintenant, quittez votre siège et marchez vers le quai.",Boa! Agora deixe sua cadeira e caminhe até a plataforma.,¡Genial! Ahora deja tu asiento y camina hacia la plataforma.,Buono! Ora lascia la tua sedia e cammina fino alla piattaforma.,Bine! Acum ridică-te de pe scaun și mergi pe peron.,Güzel! Şimdi koltuğunuzdan ayrılın ve perona doğru yürüyün.,Dobrze! Teraz opuść fotel maszynisty i przejdź na peron.,Výborně! Nyní opusťte sedadlo a jděte na plošinu.,좋습니다! 이제 의자에서 일어나서 승강장을 걸어보세요,很好！现在离开您的座位并走到站台上。,,Muito bem. Agora levante-se da cadeira e saia para a plataforma.
Lessons2.18,"Поздравляем! Вы прошли обучение. В свободном режиме вы можете выходить на любой станции для того, чтобы осмотреть их. А в некоторых сценариях вам предстоит начать игру именно на платформе.",Congratulations! You have passed the tutorial. You can leave the train on any station to take a look at it in Free Mode. In some scenarios you’ll have to start the game on a platform.,"Herzlichen Glückwünsch! Sie haben das Tutorial bestanden. Sie können den Zug an jedem Bahnhof verlassen, um ihn im Free-Modus anzuschauen. In einigen Szenarien müssen Sie das Spiel auf einer Plattform starten.","Félicitations ! Vous avez terminé le tutoriel. Vous pouvez quitter le train à n’importe quelle station pour y jeter un œil en Mode Libre. Dans certains scénarios, vous commencerez le jeu sur un quai.","Parabéns! Você passou no tutorial. Você pode deixar o trem em qualquer estação para dar uma olhada no modo livre. Em alguns cenários, você precisará iniciar o jogo em uma plataforma.",¡Felicitaciones! Has superado el tutorial. Puedes dejar el tren en cualquier estación para contemplarlo en el Modo Libre. En algunos escenarios tendrás que comenzar el juego en una plataforma.,Congratulazioni! Hai passato il tutorial. Puoi lasciare il treno su qualsiasi stazione per dare un'occhiata in modalità libera. In alcuni scenari dovrai iniziare il gioco su una piattaforma.,"Felicitări! Ai finalizat tutorialul. Poți părăsi trenul la orice stație dorești pentru a explora. În unele scenarii, va trebui să pornești jocul de pe peron. ",Tebrikler! Eğitimi tamamladınız. İstediğiniz istasyonda trenden inip serbest modda treni inceleyebilirsiniz. Bazı senaryolarda oyuna perondan başlamak zorunda kalabilirsiniz.,"Gratulacje! Ukończyłeś samouczek. Możesz opuścić pociąg na każdej ze stacji i podziwiać go w trybie swobodnym. W niektórych scenariuszach, bedziesz rozpoczynał grę nie w pociągu lecz na peronie.","Gratulujeme! Absolvovali jste kurz. Můžete opustit vlak na jakékoli stanici, abyste se na něj mohli podívat ve volném režimu. V některých případech budete muset spustit hru na platformě.",축하합니다! 튜토리얼을 완수했습니다! 자유모드에서 역들을 구경해보세요. 몇몇 시나리오에서는 승강장에서 게임이 시작됩니다.,恭喜！您已经通过了这个教程 在自由模式下，您可以将列车停靠在任何车站 在某些场景中，您必须在站台上开始您的游戏。,很好！現在離開您的座位並走到站臺上。,Parabens! Você passou do tutorial. Pode sair trem em qualquer estação para dar uma olhada no Modo Livre. Em alguns cenários você irá iniciar em uma plataforma.
Lessons2.19,"Вы превысили разрешенную скорость. Сработало экстренное торможение. Чтобы продолжить движение, вам нужно отключить тумблер экстренного торможения. Когда включено экстренное торможение, а скорость уже опустилась до разрешенного значения, можно нажать кнопку «Восприятие торможения» ({0:N1}) для того, чтобы отключить торможение. Также можно продолжить движение после полной остановки переключением реверса. Внимание! Перед этим обязательно переключите контроллер хода в «Выбег» или любую позицию торможения чтобы поезд не начал движение сразу же после переключении реверса.","You have exceeded the maximum speed limit. The emergency braking was engaged. You need to disable emergency braking switch in order to continue movement. If emergency braking has been activated, but speed has fallen below the speed limit, you can press «Braking cancellation» ({0:N1}) to deactivate emergency braking system. Also, you can move the reverse switch to Neutral and then back to Forward position to start moving after the train has fully stopped. Move the reverse switch to neutral position and move it back to «Forward». Warning! Do not forget to move the controller to «Neutral» or any braking position before doing that. Otherwise, the train will start moving just after you set reverse switch to «Forward».","Sie haben die Höchstgeschwindigkeit überschritten. Die Notbremse wurde aktiviert. Sie müssen den Notbremsschalter deaktivieren, um die Bewegung fortzusetzen. Wenn die Notbremse aktiviert wurde und die Geschwindigkeit dann unter die Geschwindigkeitsgrenze gefallen ist, können Sie die Notbremsanlage durch Drücken der «Bremsenannullierung» ({0:N1}) deaktivieren. Außerdem können Sie den Rückwärtsgangschalter auf Neutral und dann wieder in die Vorwärtsposition bringen und losfahren, nachdem der Zug vollständig angehalten hat. Bringen Sie den Rückwärtsschalter in die neutrale Position und bringen Sie ihn zurück auf «Vorwärts». Warnung! Vergessen Sie nicht, den Regler vorher auf «Neutral» oder eine andere Bremsposition zu bringen. Andernfalls wird der Zug unmittelbar nach dem Umschalten auf «Vorwärts» in Bewegung.","Vous avez enfreint la limite de vitesse et le freinage d’urgence a été activé. Vous devez désactiver l’interrupteur de freinage d’urgence pour continuer à avancer. Si le frein d'urgence a été activé mais que votre vitesse est repassée en dessous de la limite, vous pouvez appuyer sur «Annulation de freinage» ({0:N1}) pour désactiver le freinage d'urgence. Vous pouvez ainsi déplacer la manette d'inverseur sur Neutre, puis sur Marche avant pour procéder à nouveau après l'arrêt complet du train. Déplacez la manette d’inverseur sur la position «Neutre» et à nouveau sur «Marche avant». Attention ! N’oubliez pas de déplacer la manette de traction/freinage sur la position neutre ou n’importe quelle position de frein avant de réaliser cette action, sinon, le train commencera directement à avancer juste après que vous ayez placé la manette d’inverseur sur «Marche avant».","Você excedeu o limite máximo de velocidade. A frenagem de emergência foi acionada. Você precisa desativar o interruptor de frenagem de emergência para continuar o movimento. Se a frenagem de emergência foi ativada, mas a velocidade caiu abaixo do limite de velocidade, você pode pressionar «Cancelamento de frenagem» ({0:N1}) para desativar o sistema de frenagem de emergência. Além disso, você pode mover o interruptor de reversão para Neutro e depois voltar para a posição de Avanço para começar a se mover depois que o trem estiver totalmente parado. Mova o interruptor de reversão para a posição neutra e mova-o de volta para «Avançar». Aviso! Não se esqueça de mover o controlador para «Neutro» ou qualquer posição de frenagem antes de fazer isso. Caso contrário, o trem começará a se mover logo após você colocar o interruptor de reversão em «Avançar».","Acabas de exceder la velocidad máxima. Los frenos de emergencia fueron activados. Necesitas desactivarlos con el interruptor de frenos de emergencia para continuar el recorrido. Si el freno de emergencia fue activado pero la velocidad disminuyó por debajo del límite de velocidad, puedes presionar el boton de «Cancelación de freno» con el botón ({0:N1}) para desactivar el sistema de frenos de emergencia. También puedes mover el controlador inverso a «Neutral» y reubicarlo en «Avanzar» para comenzar a moverte una vez que el tren se haya detenido por completo. Mueve el controlador inverso a la posición «Neutral» y luego hacia «Avanzar». ¡Advertencia! No olvides mover el controlador hacia Neutral o hacia alguna posición de freno antes de hacer eso, de lo contrario el tren comenzará a moverse inmediatamente después de cambiar a la posición «Avanzar».","Hai superato il limite massimo di velocità. La frenata d'emergenza era impegnata. È necessario disabilitare l'interruttore di frenata di emergenza per continuare il movimento. Se la frenatura di emergenza è stata attivata, ma la velocità è scesa sotto il limite di velocità, è possibile premere «Cancellazione frenata» ({0:N1}) per disattivare il sistema di frenata di emergenza. Inoltre, puoi spostare l'interruttore di retromarcia su Neutro e poi di nuovo su Avanti per iniziare a muoverti dopo che il treno si è fermato completamente. Spostare l'interruttore di retromarcia in posizione neutra e riportarlo su «Avanti». Avvertimento! Non dimenticare di spostare il controller su «Neutro» o qualsiasi posizione di frenata prima di farlo. Altrimenti, il treno inizierà a muoversi subito dopo aver impostato l'interruttore di retromarcia su «Avanti».","Ai depășit viteza maximă admisă. Frâna de urgență a fost aplicată. Trebuie să o dezactivezi pentru a continua călătoria. Dacă frânea de urgență a fost activată, dar viteza a scăzut sub cea limită, apasă butonul «Anulare frână» ({0:N1})  pentru a dezactiva sistemul de frânare de urgență. De asemenea, poți muta inversorul în poziția neutră și după în poziția «Înainte» numai după ce trenul este complet oprit. Mută inversorul în poziția neutră și după în poziția «Înainte». Atenție! Nu uita să pui manșa pe neutru sau orice poziție de frânare înainte de a face asta. Altfel, trenul va porni numai după ce setezi inversorul pe «Înainte».","Hız limitini aştınız. Acil durum el freni devreye girdi. Harekete devam etmek için acil durum el frenini şalterden kapatmanız lazım. Eğer acil durum freni aktive olursa, ama hızınız hız limitinin altında ise, iptal etmek için «Fren İptal» ({0:N1}) tuşuna basabilirsiniz. Ayrıca, tren tamamen durduktan sonra vites kontağını ilk olarak «BOŞTA»'a sonra tekrardan «İLERİ»'ye alarak hareket etmeye başlayabilirsiniz. Vites kontağını ilk «BOŞTA» pozisyonuna ve sonra tekrardan «İLERİ» pozisyonuna alın. UYARI! Bunu yapmadan önce vitesi kesinlikle «BOŞTA» pozisyonuna veya herhangi bir frenleme pozisyonuna getirmeyi unutmayın. Aksi taktirde, tren vites kontağını «İLERİ» pozisyona getirdiğiniz gibi hareket etmeye başlar.","Przekroczyłeś limit prędkości. Został uruchomiony hamulec awaryjny. Musisz go wyłączyć aby móc jechać dalej. Jeżeli został aktywowany hamulec awaryjny i predkość jazdy spadła poniżej dopuszczalnej, możesz deaktywować hamowanie przyciskiem ({0:N1}). Jeżeli pociąg zdążył się w pełni zatrzymać, przestaw nastawnik jazdy do pozycji «Neutralny», a nastepnie ponownie do pozycji «Naprzód» aby zacząć ponownie jechać. Uważaj! Nie zapomnij wcześniej ustawić regulacji szybkości do pozycji «Neutralny», w przeciwnym wypadku pociąg zacznie jechać od razu po zadaniu jazdy «Naprzód».","Překročili jste maximální povolenou rychlost. Došlo k nouzovému brzdění. Chcete-li pokračovat v pohybu, musíte vypnout nouzový brzdový spínač. Pokud bylo aktivováno nouzové brzdění, ale rychlost klesla pod mez rychlosti, můžete stisknout «zrušení brzdění» ({0:N1}) pro deaktivaci nouzového brzdového systému. Můžete také posunout zpětný spínač na neutrální a potom zpět do polohy vpřed a začít se pohybovat po úplném zastavení vlaku. Přepněte přepínač zpět do neutrální polohy a posuňte jej zpět do polohy «vpřed». Varování! Než to uděláte, nezapomeňte přepnout regulátor do polohy «Neutral» nebo do jakékoli polohy brzdění. V opačném případě se vlak začne pohybovat právě poté, co nastavíte přepínač zpět do polohy «vpřed».",제한속도를 초과하여 비상제동이 체결되었습니다. 현재 속도가 제한 속도 아래로 떨어졌을때 «제동 완해»({0:N1})를 누르거나 정차 후 역전간을 중립에 뒀다가 전진으로 다시 전환하여 비상제동을 해제 시킬 수 있습니다. 주의 : 역전간을 바꾸기 전에 주간제어기를 타행 위치에 두세요.,您已超速 紧急制动已经打开 您需要关闭紧急制动才能继续前进 先将档位调至空档然后将其调回到“前进”的位置  警告！在此之前，不要忘记将控制器移动到“空档”或任何制动位置 否则，列车将在您将档位调为“前进”后立即开始移动。{0:N1},您已超速 緊急制動已經打開 您需要關閉緊急制動才能繼續前進 先將檔位調至空檔然後將其調回到“前進”的位置 警告！在此之前，不要忘記將控制器移動到“空檔”或任何制動位置 否則，列車將在您將檔位調為“前進”後立即開始移動。{0:N1},"Você excedeu o limite de velocidade. Os freios de emergência foram ativados. Você precisa desativar o sistema de freios de emergencia para continuar. Se os freios de emergência foram ativados, mas a velocidade ainda não caiu para baixo do limite, você pode pressionar «Cancelamento de Frenagem» ({0:N1}) para desativar os freios de emergência. Além disso, você pode mover o interruptor reverso para a posição Neutra e depois para frente para começar a se mover de novo assim que o trem terminar de parar por completo. Mova o interruptor reverso para posição neutro e depois para «Frente». Aviso! Não esqueça de mover o controle para «Neutro» ou qualquer outra posição frenagem antes de fazer isso. Caso contrário, o trem vai começar a se mover somente depois que você por o interruptor reverso para «Frente»."